{
  "id": "AUT-REV-20260718003052613-dfae2c",
  "kind": "autonomy_profile_revocation",
  "schema_version": "autonomy-profile-revocation:v1",
  "profile_ref": {
    "id": "AUT-PR-ENT-UX",
    "path": ".sdlc/autonomy/deliveries/AUT-PR-ENT-UX.json",
    "hash": "8e43f4ddbf2c6f1d7235493a55932e06b4d8cc7f3026c2c4f9902c7c7bc5cd0b"
  },
  "reason": "Superseded before task start because the work brief was refreshed to immutable post-performance project context; no repository, test, commit, push, pull-request, merge, or release action ran under this profile.",
  "approval": {
    "id": "APR-20260718003052-9eae9d",
    "profile_id": "AUT-PR-ENT-UX",
    "status": "approved",
    "summary": "Antonio authorized autonomous prerequisite repair; revoke only the unused stale UX delivery choice so a fresh non-reusable choice can be approved for the same agreed pull request.",
    "scope": {
      "principle": "A human approval applies only to the specific artifact or decision shown to the user before the approval.",
      "subject_id": "AUT-PR-ENT-UX",
      "subject_label": "delivery autonomy revocation AUT-PR-ENT-UX",
      "applies_only_to_presented_subject": true,
      "does_not_approve_future_artifacts": true,
      "requires_fresh_user_confirmation_for_new_artifacts": true,
      "approval_level": "delivery-autonomy-revocation"
    },
    "evidence": [],
    "approval_source": "explicit-user",
    "authorization_ref": null,
    "authorization_use_ref": null,
    "authorization_action": null,
    "explicit_user_confirmation": true,
    "provisional": false,
    "approved_content_hash": "860547a618110956b6e4f63e56cfda3caa0d98ac7ff7b028516f9afb6ce6f642",
    "hash_algorithm": "sha256:stable-json:v1",
    "approved_by": {
      "id": "antonio",
      "type": "human",
      "name": "Antonio Antenore",
      "email": "ant_ant95@hotmail.it",
      "source": "cli"
    },
    "git": {
      "is_git_repo": true,
      "branch": "codex/ST-ENT-UX",
      "head_sha": "7465944ac2f22b335fafdae9a006d338509c31fc",
      "is_dirty": true,
      "user": {
        "name": "Antonio Antenore",
        "email": "ant_ant95@hotmail.it"
      },
      "remotes": [
        "origin"
      ]
    },
    "run": {
      "run_id": null,
      "thread_id": "019f6f22-ba84-7631-bdaf-b074e51dba5d",
      "session_id": null,
      "tool": "agentic-sdlc-cli",
      "version": "0.11.0"
    },
    "created_at": "2026-07-18T00:30:52.613Z"
  },
  "created_at": "2026-07-18T00:30:52.613Z",
  "audit": {
    "actor": {
      "id": "antonio",
      "type": "human",
      "name": "Antonio Antenore",
      "email": "ant_ant95@hotmail.it",
      "source": "cli"
    },
    "git": {
      "is_git_repo": true,
      "branch": "codex/ST-ENT-UX",
      "head_sha": "7465944ac2f22b335fafdae9a006d338509c31fc",
      "is_dirty": true,
      "user": {
        "name": "Antonio Antenore",
        "email": "ant_ant95@hotmail.it"
      },
      "remotes": [
        "origin"
      ]
    },
    "run": {
      "run_id": null,
      "thread_id": "019f6f22-ba84-7631-bdaf-b074e51dba5d",
      "session_id": null,
      "tool": "agentic-sdlc-cli",
      "version": "0.11.0"
    }
  },
  "receipt_hash": "00012ef6acfe8b2b4b95ac8dd3c4add8143aeb7f691c710f38ec63b7a8671788",
  "hash_algorithm": "sha256:stable-json:v1"
}
